"""title"": ""Reality and the Integral Knowledge"","
"""In fact, the Brahman is one not only in a featureless oneness beyond all relation, but in the very multiplicity of the cosmic existence. Aware of the works of the dividing mind but not itself limited by it, It finds its oneness as easily in the many, in relations, in becoming as in any withdrawal from the many, from relations, from becoming. Ourselves also, to possess even its oneness fully, must possess it\u2014since it is there, since all is that\u2014in the infinite self-variation of the cosmos. The infinity of the multiplicity finds itself explained and justified only when it is contained and possessed in the infinity of the One; but also the infinity of the One pours itself out and possesses itself@667@ in the infinity of the Many. To be capable of that outpouring of its energies as well as not to lose itself in it, not to recoil defeated from its boundlessness and endlessness of vicissitudes and differences as well as not to be self-divided by its variations, is the divine strength of the free Purusha, the conscious Soul in its possession of its own immortal self-knowledge. The finite self variations of the Self in which the mind losing self-knowledge is caught and dispersed among the variations, are yet not the denials but the endless expression of the Infinite and have no other meaning or reason for existence: the Infinite too, while it possesses its delight of limitless being, finds also the joy of that very limitlessness in its infinite self-definition in the universe. The Divine Being is not incapable of taking innumerable forms because He is beyond all form in His essence, nor by assuming them does He lose His divinity, but pours out rather in them the delight of His being and the glories of His godhead; this gold does not cease to be gold because it shapes itself into all kinds of ornaments and coins itself into many currencies and values, nor does the Earth-Power, principle of all this figured material existence, lose her immutable divinity because she forms herself into habitable worlds, throws herself out in the hills and hollows and allows herself to be shaped into utensils of the hearth and household or as hard metal into the weapon and the engine. Matter,\u2014substance itself, subtle or dense, mental or material,\u2014is form and body of Spirit and would never have been created if it could not be made a basis for the self-expression of the Spirit. The apparent Inconscience of the material universe holds in itself darkly all that is eternally self-revealed in the luminous Superconscient; to reveal it in Time is the slow and deliberate delight of Nature and the aim of her cycles."","
"""It is clear that a Mind of the nature of our surface intelligence can be only a secondary power of existence. For it bears the stamp of incapacity and ignorance as a sign that it is derivative and not the original creatrix; we see that it does not know or understand the objects it perceives, it has no automatic control of them; it has to acquire a laboriously built knowledge and controlling power. This initial incapacity could not be there if@644@ these objects were the Mind's own structures, creations of its self-Power. It may be that this is so because individual mind has only a frontal and derivative power and knowledge and there is a universal Mind that is whole, endowed with omniscience, capable of omnipotence. But the nature of Mind as we know it is an Ignorance seeking for knowledge; it is a knower of fractions and worker of divisions striving to arrive at a sum, to piece together a whole,\u2014it is not possessed of the essence of things or their totality: a universal Mind of the same character might know the sum of its divisions by force of its universality, but it would still lack the essential knowledge, and without the essential knowledge there could be no true integral knowledge. A consciousness possessing the essential and integral knowledge, proceeding from the essence to the whole and from the whole to the parts, would be no longer Mind, but a perfect Truth-Consciousness automatically possessed of inherent self-knowledge and world-knowledge. It is from this basis that we have to look at the subjective view of reality. It is true that there is no such thing as an objective reality independent of consciousness; but at the same time there is a truth in objectivity and it is this, that the reality of things resides in something that is within them and is independent of the interpretation our mind gives to them and of the structures it builds upon its observation. These structures constitute the mind's subjective image or figure of the universe, but the universe and its objects are not a mere image or figure. They are in essence creations of consciousness, but of a consciousness that is one with being, whose substance is the substance of Being and whose creations too are of that substance, therefore real. In this view the world cannot be a purely subjective creation of Consciousness; the subjective and the objective truth of things are both real, they are two sides of the same Reality."","
"""For we have in this unfolding of knowledge the two terms of the One and the Many, as we have the two terms of the finite and the infinite, of that which becomes and of that which does not become but for ever is, of that which takes form and of that which does not take form, of Spirit and Matter, of the supreme Superconscient and the nethermost Inconscience; in this dualism, and to get away from it, it is open to us to define Knowledge as the possession of one term and the possession of the other as Ignorance. The ultimate of our life would then be a drawing away from the lower reality of the Becoming to the greater reality of the Being, a leap from the Ignorance to the Knowledge and a rejection of the Ignorance, a departure from the many into the One, from the finite into the infinite, from form into the formless, from the life of the material universe into the Spirit, from the hold of the inconscient upon us into the superconscient Existence. In this solution there is supposed@665@ to be a fixed opposition, an ultimate irreconcilability in each case between the two terms of our being. Or else, if both are a means of the manifestation of the Brahman, the lower is a false or imperfect clue, a means that must fail, a system of values that cannot ultimately satisfy us. Dissatisfied with the confusions of the multiplicity, disdainful of even the highest light and power and joy that it can reveal, we must drive beyond to the absolute one-pointedness and one-standingness in which all self-variation ceases. Unable by the claim of the Infinite upon us to dwell for ever in the bonds of the finite or to find there satisfaction and largeness and peace, we have to break all the bonds of individual and universal Nature, destroy all values, symbols, images, self definitions, limitations of the illimitable and lose all littleness and division in the Self that is for ever satisfied with its own infinity. Disgusted with forms, disillusioned of their false and transient attractions, wearied and discouraged by their fleeting impermanence and vain round of recurrence, we must escape from the cycles of Nature into the formlessness and featurelessness of permanent Being. Ashamed of Matter and its grossness, impatient of the purposeless stir and trouble of Life, tired out by the goalless running of Mind or convinced of the vanity of all its aims and objects, we have to release ourselves into the eternal repose and purity of the Spirit. The Inconscient is a sleep or a prison, the conscient a round of strivings without ultimate issue or the wanderings of a dream: we must wake into the superconscious where all darkness of night and half-lights cease in the self-luminous bliss of the Eternal. The Eternal is our refuge; all the rest are false values, the Ignorance and its mazes, a self-bewilderment of the soul in phenomenal Nature."","
"""This ego-centric attitude has in recent times been elevated into a valid standard of knowledge; it has been implicitly or explicitly held as an axiom that all truth must be referred to the judgment of the personal mind, reason and experience of every man or else it must be verified or at any rate verifiable by a common or universal experience in order to be valid. But obviously this is a false standard of reality and of knowledge, since this means the sovereignty of the normal or average mind and its limited capacity and experience, the exclusion of what is supernormal or beyond the average intelligence. In its extreme, this claim of the individual to be the judge of everything is an egoistic illusion, a superstition of the physical mind, in the mass a gross and vulgar error. The truth behind it is that each man has to think for himself, know for himself according to his capacity, but his judgment can be valid only on condition that he is ready to learn and open always to a larger knowledge. It is reasoned that to depart from the physical standard and the principle of personal or universal verification will lead to gross delusions and the admission of unverified truth and subjective phantasy into the realm of knowledge. But error and delusion and the introduction of personality and one's own subjectivity into the pursuit of knowledge are always present, and the physical or objective standards and methods do not exclude them. The probability of error is no reason for refusing to attempt discovery, and subjective discovery must be pursued by a subjective method of enquiry, observation and verification; research into the supraphysical must evolve, accept and test an appropriate means and methods other than those by which one examines the constituents of physical objects and the processes of Energy in material Nature.@676@"","
"""There is a precisely opposite view of reality and knowledge which affirms an objective Reality as the only entire truth and an objective knowledge as the sole entirely reliable knowledge. This view starts from the idea of physical existence as the one fundamental existence and the relegation of consciousness, mind, soul or spirit to the position of a temporary outcome of the physical Energy in its cosmic action,\u2014if indeed soul or spirit has any existence. All that is not physical and objective has a lesser reality dependent on the physical and objective; it has to justify itself to the physical mind by objective evidence or a recognisable and verifiable relation to the truth of physical and external things before it can be given a passport of reality. But it is evident that this solution cannot be accepted in its rigour, as it has no integrality in it but looks at only one side of existence, even only one province or district of existence, and leaves all the rest unexplained, without inherent reality, without significance. If pushed to its extreme, it would give to a stone or a plum-pudding a greater reality and to thought, love, courage, genius, greatness, the human soul and mind facing an obscure and dangerous world and getting mastery over it an inferior dependent reality or even an unsubstantial and evanescent reality. For in this view these things so great to our subjective vision are valid only as the reactions of an objective material being to an objective material existence; they are valid only in so far as they deal with objective realities and make themselves effective upon them: the soul, if it exists, is only a circumstance of an objectively real world-Nature. But it could be held, on the contrary, that the objective assumes value only as it has a relation to the soul; it is a field, an occasion, a means for the soul's progression in Time: the objective is created as a ground of manifestation for the subjective. The objective world is only an outward form of becoming of the Spirit; it is here a first form, a basis, but it is not the essential thing, the main truth of being. The subjective and objective are two necessary sides of the@647@ manifested Reality and of equal value, and in the range of the objective itself the supraphysical object of consciousness has as much right to acceptance as the physical objectivity; it cannot be *a priori* set aside as a subjective delusion or hallucination."","
"""In a certain sense, to use the relative and suggestive phrasing of our human language, all things are the symbols through which we have to approach and draw nearer to That by which we and they exist. The infinity of unity is one symbol, the infinity of the multiplicity is another symbol: again, since each thing in the multiplicity points back to the unity, since each thing that@645@ we call finite is a representative figure, a form-front, a silhouette shadowing out something of the infinite, all that defines itself in the universe,\u2014all its objects, happenings, idea-formations, life-formations,\u2014are in their turn each a clue and a symbol. To our subjective mind the infinity of existence is one symbol, the infinity of non-existence is another symbol. The infinity of the Inconscient and the infinity of the Superconscient are two poles of the manifestation of the absolute Parabrahman, and our existence between these two poles and our passage from one to the other are a progressive seizing, a constant interpretation, a subjective building up in ourselves of this manifestation of the Unmanifest. Through such an unfolding of our self-existence we have to arrive at the consciousness of its ineffable Presence and of ourselves and the world and all that is and all that is not as the unveiling of that which never entirely unveils itself to anything other than its own self-light eternal and absolute."","
"""There are different orders of reality; the objective and physical is only one order. It is convincing to the physical or externalising mind because it is directly obvious to the senses, while of the subjective and the supraphysical that mind has no means of knowledge except from fragmentary signs and data and inferences which are at every step liable to error. Our subjective movements and inner experiences are a domain of happenings as real as any outward physical happenings; but if the individual mind can know something of its own phenomena by direct experience, it is ignorant of what happens in the consciousness of others except by analogy with its own or such signs, data, inferences as its outward observation can give it. I am therefore inwardly real to myself, but the invisible life of others has only an indirect reality to me except in so far as it impinges on my own mind, life and senses. This is the limitation of the physical mind of man, and it creates in him a habit of believing entirely only in the physical and of doubting or challenging all that does not come into accord with his own experience or his own scope of understanding or square with his own standard or sum of established knowledge."","
"""An integral knowledge demands an exploration, an unveiling of all the possible domains of consciousness and experience. For there are subjective domains of our being which lie behind the obvious surface; these have to be fathomed and whatever is ascertained must be admitted within the scope of the total reality. An inner range of spiritual experience is one very great domain of human consciousness; it has to be entered into up to its deepest depths and its vastest reaches. The supraphysical is as real as the physical; to know it is part of a complete knowledge. The knowledge of the supraphysical has been associated with mysticism and occultism, and occultism has been banned as a superstition and a fantastic error. But the occult is a part of existence; a true occultism means no more than a research into supraphysical realities and an unveiling of the hidden laws of being and Nature, of all that is not obvious on the surface. It attempts the discovery of the secret laws of mind and mental energy, the secret laws of life and life-energy, the secret laws of the subtle-physical and its energies,\u2014all that Nature has not put into visible operation on the surface; it pursues also the application of these hidden truths and powers of Nature so as to extend the mastery of the human spirit beyond the ordinary operations of mind, the ordinary operations of life, the ordinary operations of our physical existence. In the spiritual domain which is occult to the surface mind in so far as it passes beyond normal and@651@ enters into supernormal experience, there is possible not only the discovery of the self and spirit, but the discovery of the uplifting, informing and guiding light of spiritual consciousness and the power of the spirit, the spiritual way of knowledge, the spiritual way of action. To know these things and to bring their truths and forces into the life of humanity is a necessary part of its evolution. Science itself is in its own way an occultism; for it brings to light the formulas which Nature has hidden and it uses its knowledge to set free operations of her energies which she has not included in her ordinary operations and to organise and place at the service of man her occult powers and processes, a vast system of physical magic,\u2014for there is and can be no other magic than the utilisation of secret truths of being, secret powers and processes of Nature. It may even be found that a supraphysical knowledge is necessary for the completion of physical knowledge, because the processes of physical Nature have behind them a supraphysical factor, a power and action mental, vital or spiritual which is not tangible to any outer means of knowledge."","
"""All insistence on the sole or the fundamental validity of the objective real takes its stand on the sense of the basic reality of Matter. But it is now evident that Matter is by no means fundamentally real; it is a structure of Energy: it is becoming even a little doubtful whether the acts and creations of this Energy itself are explicable except as the motions of power of a secret Mind or Consciousness of which its processes and steps of structure are the formulas. It is therefore no longer possible to take Matter as the sole reality. The material interpretation of existence was the result of an exclusive concentration, a preoccupation with one movement of Existence, and such an exclusive concentration has its utility and is therefore permissible; in recent times it has justified itself by the many immense and the innumerable minute discoveries of physical Science. But a solution of the whole problem of existence cannot be based on an exclusive one-sided knowledge; we must know not only what Matter is and what are its processes, but what mind and life are and what are their processes, and one must know also spirit and soul and all that is behind the material surface: only then can we have a knowledge sufficiently integral for a solution of the problem. For the same reason those views of existence which arise from an exclusive or predominant preoccupation with Mind or with Life and regard Mind or Life as the sole fundamental reality, have not a sufficiently wide basis for acceptance. Such a preoccupation of exclusive concentration may lead to a fruitful scrutiny which sheds much light on Mind and Life, but cannot result in a total solution of the problem. It may very well be that an exclusive or predominant concentration on the subliminal being, regarding the surface existence as a mere system of symbols for an expression of its sole reality, might throw a strong light on the subliminal and its processes and extend vastly the powers of the human being, but it would not be by itself an integral solution or lead us successfully to the integral knowledge of Reality. In our view the Spirit, the Self is the fundamental reality of existence;@679@ but an exclusive concentration on this fundamental reality to the exclusion of all reality of Mind, Life or Matter except as an imposition on the Self or unsubstantial shadows cast by the Spirit might help to an independent and radical spiritual realisation but not to an integral and valid solution of the truth of cosmic and individual existence."","
"""There is that unmanifest Unknowable; there is this manifest knowable, partly manifest to our ignorance, manifest entirely to the divine Knowledge which holds it in its own infinity. If it is true that neither our ignorance nor our utmost and widest mental knowledge can give us a hold of the Unknowable, still it is also true that, whether through our knowledge or through our ignorance,@638@ That variously manifests itself; for it cannot be manifesting something other than itself, since nothing else can exist: in this variety of manifestation there is that Oneness and through the diversity we can touch the Oneness. But even so, even accepting this co-existence, it is still possible to pass a final verdict and sentence of condemnation on the Becoming and decide on the necessity of a renunciation of it and a return into the absolute Being. This verdict can be based on the distinction between the real reality of the Absolute and the partial and misleading reality of the relative universe."","
"""But since it is from the Ignorance that we proceed to the Knowledge, we have had first to discover the secret nature and full extent of the Ignorance. If we look at this Ignorance in which ordinarily we live by the very circumstance of our separative existence in a material, in a spatial and temporal universe, we see that on its obscurer side it reduces itself, from whatever direction we look at or approach it, into the fact of a many-sided self-ignorance. We are ignorant of the Absolute which is the source of all being and becoming; we take partial facts of being, temporal relations of the becoming for the whole truth of existence,\u2014that is the first, the original ignorance. We are ignorant of the spaceless, timeless, immobile and immutable Self; we take the constant mobility and mutation of the cosmic@680@ becoming in Time and Space for the whole truth of existence,\u2014that is the second, the cosmic ignorance. We are ignorant of our universal self, the cosmic existence, the cosmic consciousness, our infinite unity with all being and becoming; we take our limited egoistic mentality, vitality, corporeality for our true self and regard everything other than that as not-self,\u2014that is the third, the egoistic ignorance. We are ignorant of our eternal becoming in Time; we take this little life in a small span of Time, in a petty field of Space, for our beginning, our middle and our end,\u2014that is the fourth, the temporal ignorance. Even within this brief temporal becoming we are ignorant of our large and complex being, of that in us which is superconscient, subconscient, intraconscient, circumconscient to our surface becoming; we take that surface becoming with its small selection of overtly mentalised experiences for our whole existence,\u2014that is the fifth, the psychological ignorance. We are ignorant of the true constitution of our becoming; we take the mind or life or body or any two of these or all three for our true principle or the whole account of what we are, losing sight of that which constitutes them and determines by its occult presence and is meant to determine sovereignly by its emergence their operations,\u2014that is the sixth, the constitutional ignorance. As a result of all these ignorances, we miss the true knowledge, government and enjoyment of our life in the world; we are ignorant in our thought, will, sensations, actions, return wrong or imperfect responses at every point to the questionings of the world, wander in a maze of errors and desires, strivings and failures, pain and pleasure, sin and stumbling, follow a crooked road, grope blindly for a changing goal,\u2014that is the seventh, the practical ignorance."","
