"""title"": ""Reality and the Integral Knowledge"","
"""In fact, subjectivity and objectivity are not independent realities, they depend upon each other; they are the Being, through consciousness, looking at itself as subject on the object and the same Being offering itself to its own consciousness as object to the subject. The more partial view concedes no substantive reality to anything which exists only in the consciousness, or, to put it more accurately, to anything to which the inner consciousness or sense bears testimony but which the outer physical senses do not provide with a ground or do not substantiate. But the outer senses can bear a reliable evidence only when they refer their version of the object to the consciousness and that consciousness gives a significance to their report, adds to its@674@ externality its own internal intuitive interpretation and justifies it by a reasoned adherence; for the evidence of the senses is always by itself imperfect, not altogether reliable and certainly not final, because it is incomplete and constantly subject to error. Indeed, we have no means of knowing the objective universe except by our subjective consciousness of which the physical senses themselves are instruments; as the world appears not only to that but in that, so it is to us. If we deny reality to the evidence of this universal witness for subjective or for supraphysical objectivities, there is no sufficient reason to concede reality to its evidence for physical objectivities; if the inner or the supraphysical objects of consciousness are unreal, the objective physical universe has also every chance of being unreal. In each case understanding, discrimination, verification are necessary; but the subjective and the supraphysical must have another method of verification than that which we apply successfully to the physical and external objective. Subjective experience cannot be referred to the evidence of the external senses; it has its own standards of seeing and its inner method of verification: so also supraphysical realities by their very nature cannot be referred to the judgment of the physical or sense mind except when they project themselves into the physical, and even then that judgment is often incompetent or subject to caution; they can only be verified by other senses and by a method of scrutiny and affirmation which is applicable to their own reality, their own nature."","
"""This ego-centric attitude has in recent times been elevated into a valid standard of knowledge; it has been implicitly or explicitly held as an axiom that all truth must be referred to the judgment of the personal mind, reason and experience of every man or else it must be verified or at any rate verifiable by a common or universal experience in order to be valid. But obviously this is a false standard of reality and of knowledge, since this means the sovereignty of the normal or average mind and its limited capacity and experience, the exclusion of what is supernormal or beyond the average intelligence. In its extreme, this claim of the individual to be the judge of everything is an egoistic illusion, a superstition of the physical mind, in the mass a gross and vulgar error. The truth behind it is that each man has to think for himself, know for himself according@649@ to his capacity, but his judgment can be valid only on condition that he is ready to learn and open always to a larger knowledge. It is reasoned that to depart from the physical standard and the principle of personal or universal verification will lead to gross delusions and the admission of unverified truth and subjective phantasy into the realm of knowledge. But error and delusion and the introduction of personality and one's own subjectivity into the pursuit of knowledge are always present, and the physical or objective standards and methods do not exclude them. The probability of error is no reason for refusing to attempt discovery, and subjective discovery must be pursued by a subjective method of enquiry, observation and verification; research into the supraphysical must evolve, accept and test an appropriate means and methods other than those by which one examines the constituents of physical objects and the processes of Energy in material Nature."","
"""In a certain sense, to use the relative and suggestive phrasing of our human language, all things are the symbols through which we have to approach and draw nearer to That by which we and they exist. The infinity of unity is one symbol, the infinity of the multiplicity is another symbol: again, since each thing in the multiplicity points back to the unity, since each thing that we call finite is a representative figure, a form-front, a silhouette shadowing out something of the infinite, all that defines itself in the universe\u2014all its objects, happenings, idea-formations, life-formations\u2014are in their turn each a clue and a symbol. To our subjective mind the infinity of existence is one symbol, the infinity of non-existence is another symbol. The infinity of the Inconscient and the infinity of the Superconscient are two poles of the manifestation of the absolute Parabrahman, and our existence between these two poles and our passage from one to the other are a progressive seizing, a constant interpretation, a subjective building up in ourselves of this manifestation of the Unmanifest. Through such an unfolding of our self-existence we have to arrive at the consciousness of its ineffable Presence and of ourselves and the world and all that is and all that is not as the unveiling of that which never entirely unveils itself to anything other than its own self-light eternal and absolute."","
"""In fact, the Brahman is one not only in a featureless oneness beyond all relation, but in the very multiplicity of the cosmic existence. Aware of the works of the dividing mind but not itself limited by it, It finds its oneness as easily in the many, in relations, in becoming as in any withdrawal from the many, from relations, from becoming. Ourselves also, to possess even its oneness fully, must possess it,\u2014since it is there, since all is that,\u2014in the infinite self-variation of the cosmos. The infinity of the multiplicity finds itself explained and justified only when it is contained and possessed in the infinity of the One; but also the infinity of the One pours itself out and possesses itself in the infinity of the Many. To be capable of that outpouring of its energies as well as not to lose itself in it, not to recoil defeated from its boundlessness and endlessness of vicissitudes and differences as well as not to be self-divided by its variations, is the divine strength of the free Purusha, the conscious Soul in its possession of its own immortal self-knowledge. The finite self-variations of the Self in which the mind losing self-knowledge is caught and dispersed among the variations, are yet not the denials but the endless expression of the Infinite and have no other meaning or reason for existence: the Infinite too, while it possesses its delight of limitless being, finds also the joy of that very limitlessness in its infinite self-definition in the universe. The Divine Being is not incapable of taking innumerable forms because He is beyond all form in His essence, nor by assuming@641@ them does He lose His divinity, but pours out rather in them the delight of His being and the glories of His godhead; this gold does not cease to be gold because it shapes itself into all kinds of ornaments and coins itself into many currencies and values, nor does the Earth-Power, principle of all this figured material existence, lose her immutable divinity because she forms herself into habitable worlds, throws herself out in the hills and hollows and allows herself to be shaped into utensils of the hearth and household or as hard metal into the weapon and the engine. Matter,\u2014substance itself, subtle or dense, mental or material,\u2014is form and body of Spirit and would never have been created if it could not be made a basis for the self-expression of the Spirit. The apparent Inconscience of the material universe holds in itself darkly all that is eternally self-revealed in the luminous Superconscient; to reveal it in Time is the slow and deliberate delight of Nature and the aim of her cycles."","
"""On the other hand, if the constructing Mind or Consciousness is real and the sole reality, then the universe of material beings and objects may have an existence, but it is purely subjective-structural, made by Consciousness out of itself, maintained by it, dissolving into it in their disappearance. For if there is nothing else, no essential Existence or Being supporting@669@ the creative Power, and there is not, either, a sustaining Void or Nihil, then this Consciousness which creates everything must itself have or be an existence or a substance; if it can make structures, they must be constructions out of its own substance or forms of its own existence. A consciousness which is not that of an Existence or is not itself an existence, must be an unreality, a perceptive Force of a Void or in a Void raising there unreal structures made of nothing,\u2014a proposition which is not easily acceptable unless all others prove to be invalid. It then becomes apparent that what we see as consciousness must be a Being or an Existence out of whose substance of consciousness all is created."","
"""All insistence on the sole or the fundamental validity of the objective real takes its stand on the sense of the basic reality of Matter. But it is now evident that Matter is by no means fundamentally real; it is a structure of Energy: it is becoming even a little doubtful whether the acts and creations of this Energy itself are explicable except as the motions of power of a secret Mind or Consciousness of which its processes and steps of structure are the formulas. It is therefore no longer possible to take Matter as the sole reality. The material interpretation of existence was the result of an exclusive concentration, a preoccupation with one movement of Existence, and such an exclusive concentration has its utility and is therefore permissible; in recent times it has justified itself by the many immense and the innumerable minute discoveries of physical Science. But a solution of the whole problem of existence cannot be based on an exclusive one-sided knowledge; we must know not only what Matter is and what are its processes, but what mind and life are and what are their processes, and one must know also spirit and soul and all that is behind the material surface: only then can we have a knowledge@652@ sufficiently integral for a solution of the problem. For the same reason those views of existence which arise from an exclusive or predominant preoccupation with Mind or with Life and regard Mind or Life as the sole fundamental reality, have not a sufficiently wide basis for acceptance. Such a preoccupation of exclusive concentration may lead to a fruitful scrutiny which sheds much light on Mind and Life, but cannot result in a total solution of the problem. It may very well be that an exclusive or predominant concentration on the subliminal being, regarding the surface existence as a mere system of symbols for an expression of its sole reality, might throw a strong light on the subliminal and its processes and extend vastly the powers of the human being, but it would not be by itself an integral solution or lead us successfully to the integral knowledge of Reality. In our view the Spirit, the Self is the fundamental reality of existence; but an exclusive concentration on this fundamental reality to the exclusion of all reality of Mind, Life or Matter except as an imposition on the Self or unsubstantial shadows cast by the Spirit might help to an independent and radical spiritual realisation but not to an integral and valid solution of the truth of cosmic and individual existence."","
"""An integral knowledge presupposes an integral Reality; for it is the power of a Truth-Consciousness which is itself the consciousness of the Reality. But our idea and sense of Reality vary with our status and movement of consciousness, its sight, its stress, its intake of things; that sight or stress can be intensive and exclusive or extensive, inclusive and comprehensive. It is quite possible,\u2014and it is in its own field a valid movement for our thought and for a very high line of spiritual achievement,\u2014to affirm the existence of the ineffable Absolute, to emphasise its sole Reality and to negate and abolish for our self, to expunge from our idea and sense of reality, the individual being and the cosmic creation. The reality of the individual is Brahman the Absolute; the reality of the cosmos is Brahman the Absolute: the individual is a phenomenon, a temporal appearance in the cosmos; the cosmos itself is a phenomenon, a larger and more complex temporal appearance. The two terms, Knowledge and Ignorance,@634@ belong only to this appearance; in order to reach an absolute superconsciousness both have to be transcended: ego-consciousness and cosmic consciousness are extinguished in that supreme transcendence and there remains only the Absolute. For the absolute Brahman exists only in its own identity and is beyond all other-knowledge; there the very idea of the knower and the known and therefore of the knowledge in which they meet and become one, disappears, is transcended and loses its validity, so that to mind and speech the absolute Brahman must remain always unattainable. In opposition to the view we have put forward or in completion of it,\u2014the view of the Ignorance itself as only either a limited or an involved action of the divine Knowledge, limited in the partly conscient, involved in the inconscient,\u2014we might say from this other end of the scale of things that Knowledge itself is only a higher Ignorance, since it stops short of the absolute Reality which is self-evident to Itself but to mind unknowable. This absolutism corresponds to a truth of thought and to a truth of supreme experience in the spiritual consciousness; but by itself it is not the whole of spiritual thought complete and comprehensive and it does not exhaust the possibilities of the supreme spiritual experience."","
"""An integral spiritual consciousness carries in it a knowledge of all the terms of being; it links the highest to the lowest through all the mediating terms and achieves an indivisible whole. At the highest summit of things it opens to the reality, ineffable because superconscient to all but its own self-awareness, of the Absolute. At the lowest end of our being it perceives the Inconscience from which our evolution begins; but at the same time it is aware of the One and the All self-involved in those depths, it unveils the secret Consciousness in the Inconscience. Interpretative, revelatory, moving between these two extremes, its vision discovers the manifestation of the One in the Many, the identity of the Infinite in the disparity of things finite, the presence of the timeless Eternal in eternal Time; it is this seeing that illumines for it the meaning of the universe. This consciousness does not abolish the universe; it takes it up and transforms it by giving to it its hidden significance. It does not abolish the individual existence; it transforms the individual being and nature by revealing to them their true significance and enabling them to overcome their separateness from the Divine Reality and the Divine Nature."","
"""There are different orders of reality; the objective and physical is only one order. It is convincing to the physical or externalising mind because it is directly obvious to the senses, while of the subjective and the supraphysical that mind has no means of knowledge except from fragmentary signs and data and inferences which are at every step liable to error. Our subjective movements and inner experiences are a domain of happenings as real as any outward physical happenings; but if the individual mind can know something of its own phenomena by direct experience, it is ignorant of what happens in the consciousness of others except by analogy with its own or such signs, data, inferences as its outward observation can give it.@675@ I am therefore inwardly real to myself, but the invisible life of others has only an indirect reality to me except in so far as it impinges on my own mind, life and senses. This is the limitation of the physical mind of man, and it creates in him a habit of believing entirely only in the physical and of doubting or challenging all that does not come into accord with his own experience or his own scope of understanding or square with his own standard or sum of established knowledge."","
"""An integral knowledge then must be a knowledge of the truth of all sides of existence both separately and in the relation of each to all and the relation of all to the truth of the Spirit. Our present state is an Ignorance and a many-sided seeking; it seeks for the truth of all things but,\u2014as is evident from the insistence and the variety of the human mind's speculations as to the fundamental Truth which explains all others, the Reality at the basis of all things,\u2014the fundamental truth of things, their basic reality must be found in some at once fundamental and universal Real; it is that which, once discovered, must embrace and explain all,\u2014for \""That being known all will be known\"": the fundamental Real must necessarily be and contain the truth of all existence, the truth of the individual, the truth of the universe, the truth of all that is beyond the universe. The Mind, in seeking for such a Reality and testing each thing from Matter upwards to see if that might not be It, has not proceeded on a wrong intuition. All that is necessary is to carry the@653@ inquiry to its end and test the highest and ultimate levels of experience."","
"""But if we thus get back to the biune or the dual reality of Being and Consciousness, we can either suppose with Vedanta one original Being or with Sankhya a plurality of beings to whom Consciousness or some Energy to which we attribute consciousness presents its structures. If a plurality of separate original beings alone is real, then, since each would be or create its own world in its own consciousness, the difficulty is to account for their relations in a single identical universe; there must be a one Consciousness or one Energy,\u2014corresponding to the Sankhya idea of a single Prakriti which is the field of experience of many like Purushas,\u2014in which they meet in an identical mind-constructed universe. This theory of things has the advantage of accounting for the multitude of souls and multitude of things and the oneness in diversity of their experience, while at the same time it gives a reality to the separate spiritual growth and destiny of the individual being. But if we can suppose a One Consciousness, or a One Energy, creating a multitude of figures of itself and accommodating in its world a plurality of beings, there is no difficulty in supposing a one original Being who supports or expresses himself in a plurality of beings,\u2014souls or spiritual powers of his one-existence; it would follow also that all objects, all the figures of consciousness would be figures of the Being. It must then be asked whether this plurality and these figures are realities of the one Real Existence, or representative personalities and images only, or symbols or values created by@670@ Mind to represent It. This would depend largely on whether it is only Mind as we know it that is in action or a deeper and greater Consciousness, of which Mind is a surface instrument, executrix of its initiations, medium of its manifestations. If it is the former, the universe constructed and seen by Mind can only have a subjective or symbolic or representative reality: if the latter, then the universe and its natural beings and objects can be true realities of the One Existence, forms or powers of its being manifested by its force of being. Mind would be only an interpreter between the universal Reality and the manifestations of its creative Consciousness-Force, Shakti, Prakriti, Maya."","
"""An integral knowledge then must be a knowledge of the truth of all sides of existence both separately and in the relation of each to all and the relation of all to the truth of the Spirit. Our present state is an Ignorance and a many-sided seeking; it seeks for the truth of all things but,\u2014as is evident from the insistence and the variety of the human mind's speculations as to the fundamental Truth which explains all others, the Reality at the basis of all things,\u2014the fundamental truth of things, their basic reality must be found in some at once fundamental and universal Real; it is that which, once discovered, must embrace and explain all,\u2014for \""That being known all will be known\"": the fundamental Real must necessarily be and contain the truth of all existence, the truth of the individual, the truth of the universe, the truth of all that is beyond the universe. The Mind, in seeking for such a Reality and testing each thing from Matter upwards to see if that might not be It, has not proceeded on a wrong intuition. All that is necessary is to carry the inquiry to its end and test the highest and ultimate levels of experience."","
"""But this is not an intellectual knowledge which can be learned and completed in our present mould of consciousness; it must be an experience, a becoming, a change of consciousness, a change of being. This brings in the evolutionary character of the Becoming and the fact that our mental ignorance is only a stage in our evolution. The integral knowledge, then, can only come by an evolution of our being and our nature, and that would seem to signify a slow process in Time such as has accompanied the other evolutionary transformations. But as against that inference there is the fact that the evolution has now become conscious and its method and steps need not be altogether of the same character as when it was subconscious in its process. The integral knowledge, since it must result from a change of consciousness, can be gained by a process in which our will and endeavour have a part, in which they can discover and apply their own steps and method: its growth in us can proceed by a conscious self-transformation. It is necessary then to see what is likely to be the principle of this new process of evolution and what are the movements of the integral knowledge that must necessarily emerge in it,\u2014or, in other words, what is the nature of the consciousness that must be the base of the life divine and how that life may be expected to be formed or to form itself, to materialise or, as one might say, to \""realise\"".@682@"","
