"""title"": ""Reality and the Integral Knowledge"","
"""text"": ["
"""There is a precisely opposite view of reality and knowledge which affirms an objective Reality as the only entire truth and an objective knowledge as the sole entirely reliable knowledge. This view starts from the idea of physical existence as the one fundamental existence and the relegation of consciousness, mind, soul or spirit to the position of a temporary outcome of the physical Energy in its cosmic action,\u2014if indeed soul or spirit has any existence. All that is not physical and objective has a lesser reality dependent on the physical and objective; it has to justify itself to the physical mind by objective evidence or a recognisable and verifiable relation to the truth of physical and external things before it can be given a passport of reality. But it is evident that this solution cannot be accepted in its@673@ rigour, as it has no integrality in it but looks at only one side of existence, even only one province or district of existence, and leaves all the rest unexplained, without inherent reality, without significance. If pushed to its extreme, it would give to a stone or a plum-pudding a greater reality and to thought, love, courage, genius, greatness, the human soul and mind facing an obscure and dangerous world and getting mastery over it an inferior dependent reality or even an unsubstantial and evanescent reality. For in this view these things so great to our subjective vision are valid only as the reactions of an objective material being to an objective material existence; they are valid only in so far as they deal with objective realities and make themselves effective upon them: the soul, if it exists, is only a circumstance of an objectively real world-Nature. But it could be held, on the contrary, that the objective assumes value only as it has a relation to the soul; it is a field, an occasion, a means for the soul's progression in Time: the objective is created as a ground of manifestation for the subjective. The objective world is only an outward form of becoming of the Spirit; it is here a first form, a basis, but it is not the essential thing, the main truth of being. The subjective and objective are two necessary sides of the manifested Reality and of equal value, and in the range of the objective itself the supraphysical object of consciousness has as much right to acceptance as the physical objectivity; it cannot be *a priori* set aside as a subjective delusion or hallucination."","
"""But this way of seeing things belongs to the action of the mind interpreting the relation between the Being and the external Becoming; it is valid as a dynamic mental representation corresponding to a certain truth of the manifestation, but subject to the proviso that these symbolic values of things do not make the things themselves mere significant counters, abstract symbols like mathematical formulae or other signs used by the mind for knowledge: for forms and happenings in the universe are realities significant of Reality; they are self-expressions of That, movements and powers of the Being. Each form is there because it is an expression of some power of That which inhabits it; each happening is a movement in the working out of some Truth of the Being in its dynamic process of manifestation. It is this significance that gives validity to the mind's interpretative knowledge, its subjective construction of the universe; our mind is primarily a percipient and interpreter, secondarily and derivatively a creator. This indeed is the value of all mental subjectivity that it reflects in it some truth of the Being which exists independently of the reflection,\u2014whether that independence presents itself as a physical objectivity or a supraphysical reality perceived by the mind but not perceptible by the physical senses. Mind, then, is not the original constructor of the universe: it@646@ is an intermediate power valid for certain actualities of being; an agent, an intermediary, it actualises possibilities and has its share in the creation, but the real creatrix is a Consciousness, an Energy inherent in the transcendent and cosmic Spirit."","
"""Our conception of the Knowledge and the Ignorance rejects this negation and the oppositions on which it is founded: it points to a larger if more difficult issue of reconciliation. For we see that these apparently opposite terms of One and Many, Form and the Formless, Finite and Infinite, are not so much opposites as complements of each other; not alternating values of the Brahman which in its creation perpetually loses oneness to find itself in multiplicity and, unable to discover itself in multiplicity,@666@ loses it again to recover oneness, but double and concurrent values which explain each other; not hopelessly incompatible alternatives, but two faces of the one Reality which can lead us to it by our realisation of both together and not only by testing each separately,\u2014even though such separate testing may be a legitimate or even an inevitable step or part of the process of knowledge. Knowledge is no doubt the knowledge of the One, the realisation of the Being; Ignorance is a self-oblivion of Being, the experience of separateness in the multiplicity and a dwelling or circling in the ill-understood maze of becomings: but this is cured by the soul in the Becoming growing into knowledge, into awareness of the Being which becomes in the multiplicity all these existences and can so become because their truth is already there in its timeless existence. The integral knowledge of Brahman is a consciousness in possession of both together, and the exclusive pursuit of either closes the vision to one side of the truth of the omnipresent Reality. The possession of the Being who is beyond all becomings, brings to us freedom from the bonds of attachment and ignorance in the cosmic existence and brings by that freedom a free possession of the Becoming and of the cosmic existence. The knowledge of the Becoming is a part of knowledge; it acts as an Ignorance only because we dwell imprisoned in it, *avidy\u0101y\u0101m antare*, without possessing the Oneness of the Being, which is its base, its stuff, its spirit, its cause of manifestation and without which it could not be possible."","
"""But this way of seeing things belongs to the action of the mind interpreting the relation between the Being and the external@672@ Becoming; it is valid as a dynamic mental representation corresponding to a certain truth of the manifestation, but subject to the proviso that these symbolic values of things do not make the things themselves mere significant counters, abstract symbols like mathematical formulae or other signs used by the mind for knowledge: for forms and happenings in the universe are realities significant of Reality; they are self-expressions of That, movements and powers of the Being. Each form is there because it is an expression of some power of That which inhabits it; each happening is a movement in the working out of some Truth of the Being in its dynamic process of manifestation. It is this significance that gives validity to the mind's interpretative knowledge, its subjective construction of the universe; our mind is primarily a percipient and interpreter, secondarily and derivatively a creator. This indeed is the value of all mental subjectivity that it reflects in it some truth of the Being which exists independently of the reflection,\u2014whether that independence presents itself as a physical objectivity or a supraphysical reality perceived by the mind but not perceptible by the physical senses. Mind, then, is not the original constructor of the universe: it is an intermediate power valid for certain actualities of being; an agent, an intermediary, it actualises possibilities and has its share in the creation, but the real creatrix is a Consciousness, an Energy inherent in the transcendent and cosmic Spirit."","
"""Our conception of the Knowledge and the Ignorance rejects this negation and the oppositions on which it is founded: it points to a larger if more difficult issue of reconciliation. For we see that these apparently opposite terms of One and Many, Form and the Formless, Finite and Infinite, are not so much opposites as complements of each other; not alternating values of the Brahman which in its creation perpetually loses oneness to find itself in multiplicity and, unable to discover itself in multiplicity, loses it again to recover oneness, but double and concurrent values which explain each other; not hopelessly incompatible alternatives, but two faces of the one Reality which can lead us to it by our realisation of both together and not only by testing each separately,\u2014even though such separate testing may be a legitimate or even an inevitable step or part of the process of knowledge. Knowledge is no doubt the knowledge of the One, the realisation of the Being; Ignorance is a self-oblivion of Being, the experience of separateness in the multiplicity and a dwelling or circling in the ill-understood maze of becomings: but this is cured by the soul in the Becoming growing into knowledge, into awareness of the Being which becomes in the multiplicity all these existences and can so become@640@ because their truth is already there in its timeless existence. The integral knowledge of Brahman is a consciousness in possession of both together, and the exclusive pursuit of either closes the vision to one side of the truth of the omnipresent Reality. The possession of the Being who is beyond all becomings, brings to us freedom from the bonds of attachment and ignorance in the cosmic existence and brings by that freedom a free possession of the Becoming and of the cosmic existence. The knowledge of the Becoming is a part of knowledge; it acts as an Ignorance only because we dwell imprisoned in it, *avidy\u0101y\u0101m antare*, without possessing the Oneness of the Being, which is its base, its stuff, its spirit, its cause of manifestation and without which it could not be possible."","
"""For we have in this unfolding of knowledge the two terms of the One and the Many, as we have the two terms of the finite and the infinite, of that which becomes and of that which does not become but for ever is, of that which takes form and of that which does not take form, of Spirit and Matter, of the supreme Superconscient and the nethermost Inconscience; in this dualism, and to get away from it, it is open to us to define Knowledge as the possession of one term and the possession of the other as Ignorance. The ultimate of our life would then be a drawing away from the lower reality of the Becoming to the greater reality of the Being, a leap from the Ignorance to the Knowledge and a rejection of the Ignorance, a departure from the many into the One, from the finite into the infinite, from form into the formless, from the life of the material universe into the Spirit, from the hold of the inconscient upon us into the superconscient Existence. In this solution there is supposed to be a fixed opposition, an ultimate irreconcilability in each case between the two terms of our being. Or else, if both are a means of the manifestation of the Brahman, the lower is a false or imperfect clue, a means that must fail, a system of values that cannot ultimately satisfy us. Dissatisfied with the confusions of the multiplicity, disdainful of even the highest light and power and joy that it can reveal, we must drive beyond to the absolute one-pointedness and one-standingness in which all self-variation ceases. Unable by the claim of the Infinite upon us to dwell for ever in the bonds of the finite or to find there satisfaction and largeness and peace, we have to break all the bonds of individual and universal Nature, destroy all values, symbols, images, self-definitions, limitations@639@ of the illimitable and lose all littleness and division in the Self that is for ever satisfied with its own infinity. Disgusted with forms, disillusioned of their false and transient attractions, wearied and discouraged by their fleeting impermanence and vain round of recurrence, we must escape from the cycles of Nature into the formlessness and featurelessness of permanent Being. Ashamed of Matter and its grossness, impatient of the purposeless stir and trouble of Life, tired out by the goalless running of Mind or convinced of the vanity of all its aims and objects, we have to release ourselves into the eternal repose and purity of the Spirit. The Inconscient is a sleep or a prison, the conscient a round of strivings without ultimate issue or the wanderings of a dream: we must wake into the superconscious where all darkness of night and half-lights cease in the self-luminous bliss of the Eternal. The Eternal is our refuge; all the rest are false values, the Ignorance and its mazes, a self-bewilderment of the soul in phenomenal Nature."","
"""An integral knowledge demands an exploration, an unveiling of all the possible domains of consciousness and experience.@677@ For there are subjective domains of our being which lie behind the obvious surface; these have to be fathomed and whatever is ascertained must be admitted within the scope of the total reality. An inner range of spiritual experience is one very great domain of human consciousness; it has to be entered into up to its deepest depths and its vastest reaches. The supraphysical is as real as the physical; to know it is part of a complete knowledge. The knowledge of the supraphysical has been associated with mysticism and occultism, and occultism has been banned as a superstition and a fantastic error. But the occult is a part of existence; a true occultism means no more than a research into supraphysical realities and an unveiling of the hidden laws of being and Nature, of all that is not obvious on the surface. It attempts the discovery of the secret laws of mind and mental energy, the secret laws of life and life-energy, the secret laws of the subtle-physical and its energies,\u2014all that Nature has not put into visible operation on the surface; it pursues also the application of these hidden truths and powers of Nature so as to extend the mastery of the human spirit beyond the ordinary operations of mind, the ordinary operations of life, the ordinary operations of our physical existence. In the spiritual domain, which is occult to the surface mind in so far as it passes beyond normal and enters into supernormal experience, there is possible not only the discovery of the self and spirit, but the discovery of the uplifting, informing and guiding light of spiritual consciousness and the power of the spirit, the spiritual way of knowledge, the spiritual way of action. To know these things and to bring their truths and forces into the life of humanity is a necessary part of its evolution. Science itself is in its own way an occultism; for it brings to light the formulas which Nature has hidden and it uses its knowledge to set free operations of her energies which she has not included in her ordinary operations and to organise and place at the service of man her occult powers and processes, a vast system of physical magic,\u2014for there is and can be no other magic than the utilisation of secret truths of being, secret powers and processes of Nature. It may even be found that a supraphysical knowledge is necessary for the completion of physical knowledge, because the@678@ processes of physical Nature have behind them a supraphysical factor, a power and action mental, vital or spiritual which is not tangible to any outer means of knowledge."","
"""Our conception of the Ignorance will necessarily determine our conception of the Knowledge and determine, therefore, since our life is the Ignorance at once denying and seeking after the Knowledge, the goal of human effort and the aim of the cosmic endeavour. Integral knowledge will then mean the cancelling of the sevenfold Ignorance by the discovery of what it misses and ignores, a sevenfold self-revelation within our consciousness:\u2014it will mean the knowledge of the Absolute as the origin of all@681@ things; the knowledge of the Self, the Spirit, the Being and of the cosmos as the Self's becoming, the becoming of the Being, a manifestation of the Spirit; the knowledge of the world as one with us in the consciousness of our true self, thus cancelling our division from it by the separative idea and life of ego; the knowledge of our psychic entity and its immortal persistence in Time beyond death and earth-existence; the knowledge of our greater and inner existence behind the surface; the knowledge of our mind, life and body in its true relation to the self within and the superconscient spiritual and supramental being above them; the knowledge, finally, of the true harmony and true use of our thought, will and action and a change of all our nature into a conscious expression of the truth of the Spirit, the Self, the Divinity, the integral spiritual Reality."","
"""But since it is from the Ignorance that we proceed to the Knowledge, we have had first to discover the secret nature and full extent of the Ignorance. If we look at this Ignorance in which ordinarily we live by the very circumstance of our separative existence in a material, in a spatial and temporal universe, we see that on its obscurer side it reduces itself, from whatever direction we look at or approach it, into the fact of a many-sided self-ignorance. We are ignorant of the Absolute which is the source of all being and becoming; we take partial facts of being, temporal relations of the becoming for the whole truth of existence,\u2014that is the first, the original ignorance. We are ignorant of the spaceless, timeless, immobile and immutable Self; we take the constant mobility and mutation of the cosmic becoming in Time and Space for the whole truth of existence,\u2014that is the second, the cosmic ignorance. We are ignorant of our universal self, the cosmic existence, the cosmic consciousness, our infinite unity with all being and becoming; we take our limited egoistic mentality, vitality, corporeality for our true self and regard everything other than that as not-self,\u2014that is the third, the egoistic ignorance. We are ignorant of our eternal becoming in Time; we take this little life in a small span of Time, in a petty field of Space, for our beginning, our middle and our end,\u2014that is the fourth, the temporal ignorance. Even within this brief temporal becoming we are ignorant of our large and complex being, of that in us which is superconscient, subconscient, intraconscient, circumconscient to our surface becoming; we take that surface becoming with its small selection of overtly mentalised experiences for our whole existence,\u2014that is the fifth, the psychological ignorance. We are ignorant of the true constitution of our becoming; we take the mind or life or body or any two of these or all three for our true principle or the whole account of what we are, losing sight of that which constitutes them and determines by its occult presence and is meant to determine sovereignly by its emergence their operations,\u2014that is the sixth, the constitutional ignorance. As a result of all these ignorances, we miss the true knowledge, government and enjoyment of our life in the@654@ world; we are ignorant in our thought, will, sensations, actions, return wrong or imperfect responses at every point to the questionings of the world, wander in a maze of errors and desires, strivings and failures, pain and pleasure, sin and stumbling, follow a crooked road, grope blindly for a changing goal,\u2014that is the seventh, the practical ignorance."","
"""This then is the origin, this the nature, these the boundaries of the Ignorance. Its origin is a limitation of knowledge, its distinctive character a separation of the being from its own integrality and entire reality; its boundaries are determined by this separative development of the consciousness, for it shuts us to our true self and to the true self and whole nature of things and obliges us to live in an apparent surface existence. A return or a progress to integrality, a disappearance of the limitation, a breaking down of separativeness, an overpassing of boundaries, a recovery of our essential and whole reality must be the sign and opposite character of the inner turn towards Knowledge. There must be a replacement of a limited and separative by an essential and integral consciousness identified with the original truth and the whole truth of self and existence. The integral Knowledge is something that is already there in the integral Reality: it is not a new or still non-existent thing that has to be created, acquired, learned, invented or built up by the mind; it must rather be discovered or uncovered, it is a Truth that is self-revealed to a spiritual endeavour: for it is there veiled in our deeper and greater self; it is the very stuff of our own spiritual consciousness, and it is by awaking to it even in our surface self that we have to possess it. There is an integral self-knowledge that we have to recover and, because the world-self also is our self, an integral world-knowledge. A knowledge that can be learned or constructed by the mind exists and has@633@ its value, but that is not what is meant when we speak of the Knowledge and the Ignorance."","
"""The absolutist view of reality, consciousness and knowledge is founded on one side of the earliest Vedantic thought, but it is not the whole of that thinking. In the Upanishads, in the inspired scripture of the most ancient Vedanta, we find the affirmation of the Absolute, the experience-concept of the utter and ineffable Transcendence; but we find also, not in contradiction to it but as its corollary, an affirmation of the cosmic Divinity, an experience-concept of the cosmic Self and the becoming of Brahman in the universe. Equally, we find the affirmation of the Divine Reality in the individual: this too is an experience concept; it is seized upon not as an appearance, but as an@661@ actual becoming. In place of a sole supreme exclusive affirmation negating all else than the transcendent Absolute we find a comprehensive affirmation carried to its farthest conclusion: this concept of Reality and of Knowledge enveloping in one view the cosmic and the Absolute coincides fundamentally with our own; for it implies that the Ignorance too is a half-veiled part of the Knowledge and world-knowledge a part of self-knowledge. The Isha Upanishad insists on the unity and reality of all the manifestations of the Absolute; it refuses to confine truth to any one aspect. Brahman is the stable and the mobile, the internal and the external, all that is near and all that is far whether spiritually or in the extension of Time and Space; it is the Being and all becomings, the Pure and Silent who is without feature or action and the Seer and Thinker who organises the world and its objects; it is the One who becomes all that we are sensible of in the universe, the Immanent and that in which he takes up his dwelling. The Upanishad affirms the perfect and the liberating knowledge to be that which excludes neither the Self nor its creations: the liberated spirit sees all these as becomings of the Self-existent in an internal vision and by a consciousness which perceives the universe within itself instead of looking out on it, like the limited and egoistic mind, as a thing other than itself. To live in the cosmic Ignorance is a blindness, but to confine oneself in an exclusive absolutism of Knowledge is also a blindness: to know Brahman as at once and together the Knowledge and the Ignorance, to attain to the supreme status at once by the Becoming and the Non-Becoming, to relate together realisation of the transcendent and the cosmic self, to achieve foundation in the supramundane and a self-aware manifestation in the mundane, is the integral knowledge; that is the possession of Immortality. It is this whole consciousness with its complete knowledge that builds the foundation of the Life Divine and makes its attainment possible. It follows that the absolute reality of the Absolute must be, not a rigid indeterminable oneness, not an infinity vacant of all that is not a pure self-existence attainable only by the exclusion of the many and the finite, but something which is beyond these definitions, beyond indeed@662@ any description either positive or negative. All affirmations and negations are expressive of its aspects, and it is through both a supreme affirmation and a supreme negation that we can arrive at the Absolute."","
