"""title"": ""Reality and the Integral Knowledge"","
"""The absolutist view of reality, consciousness and knowledge is founded on one side of the earliest Vedantic thought, but it is not the whole of that thinking. In the Upanishads, in the inspired scripture of the most ancient Vedanta, we find the affirmation of the Absolute, the experience-concept of the utter and ineffable Transcendence; but we find also, not in contradiction to it but as its corollary, an affirmation of the cosmic Divinity, an experience-concept of the cosmic Self and the becoming of Brahman in the universe. Equally, we find the affirmation of the Divine Reality in the individual: this too is an experience-concept; it is seized upon not as an appearance, but as an actual becoming. In place of a sole supreme exclusive affirmation negating all else than the transcendent Absolute we find a comprehensive affirmation carried to its farthest conclusion: this concept of Reality and of Knowledge enveloping in one view the cosmic and the Absolute coincides fundamentally with our own; for it implies that the Ignorance too is a half-veiled part of the Knowledge and world-knowledge@635@ a part of self-knowledge. The Isha Upanishad insists on the unity and reality of all the manifestations of the Absolute; it refuses to confine truth to any one aspect. Brahman is the stable and the mobile, the internal and the external, all that is near and all that is far whether spiritually or in the extension of Time and Space; it is the Being and all becomings, the Pure and Silent who is without feature or action and the Seer and Thinker who organises the world and its objects; it is the One who becomes all that we are sensible of in the universe, the Immanent and that in which he takes up his dwelling. The Upanishad affirms the perfect and the liberating knowledge to be that which excludes neither the Self nor its creations: the liberated spirit sees all these as becomings of the Self-existent in an internal vision and by a consciousness which perceives the universe within itself instead of looking out on it, like the limited and egoistic mind, as a thing other than itself. To live in the cosmic Ignorance is a blindness, but to confine oneself in an exclusive absolutism of Knowledge is also a blindness: to know Brahman as at once and together the Knowledge and the Ignorance, to attain to the supreme status at once by the Becoming and the Non-Becoming, to relate together realisation of the transcendent and the cosmic self, to achieve foundation in the supramundane and a self-aware manifestation in the mundane, is the integral knowledge; that is the possession of Immortality. It is this whole consciousness with its complete knowledge that builds the foundation of the Life Divine and makes its attainment possible. It follows that the absolute reality of the Absolute must be, not a rigid indeterminable oneness, not an infinity vacant of all that is not a pure self-existence attainable only by the exclusion of the many and the finite, but something which is beyond these definitions, beyond indeed any description either positive or negative. All affirmations and negations are expressive of its aspects, and it is through both a supreme affirmation and a supreme negation that we can arrive at the Absolute."","
"""This then is the origin, this the nature, these the boundaries of the Ignorance. Its origin is a limitation of knowledge, its distinctive character a separation of the being from its own integrality and entire reality; its boundaries are determined by this separative development of the consciousness, for it shuts us to our true self and to the true self and whole nature of things and obliges us to live in an apparent surface existence. A return or a progress to integrality, a disappearance of the limitation, a breaking down of separativeness, an overpassing of boundaries, a recovery of our essential and whole reality must be the sign and opposite character of the inner turn towards Knowledge. There must be a replacement of a limited and separative by an essential and integral consciousness identified with the original truth and the whole truth of self and existence. The integral Knowledge is something that is already there in the integral Reality: it is not a new or still non-existent thing that has to be created, acquired, learned, invented or built up by the mind; it must rather be discovered or uncovered, it is a Truth that is self-revealed to a spiritual endeavour: for it is there veiled in our deeper and greater self; it is the very stuff of our own spiritual@659@ consciousness, and it is by awaking to it even in our surface self that we have to possess it. There is an integral self-knowledge that we have to recover and, because the world-self also is our self, an integral world-knowledge. A knowledge that can be learned or constructed by the mind exists and has its value, but that is not what is meant when we speak of the Knowledge and the Ignorance."","
"""To refuse to enquire upon any general ground preconceived and *a priori* is an obscurantism as prejudicial to the extension of knowledge as the religious obscurantism which opposed in Europe the extension of scientific discovery. The greatest inner discoveries, the experience of self-being, the cosmic consciousness, the inner calm of the liberated spirit, the direct effect of mind upon mind, the knowledge of things by consciousness in direct contact with other consciousness or with its objects, most spiritual experiences of any value, cannot be brought before the tribunal of the common mentality which has no experience of these things and takes its own absence or incapacity of experience as a proof of their invalidity or their non-existence. Physical truth or formulas, generalisations, discoveries founded upon physical observation can be so referred, but even there a training of capacity is needed before one can truly understand and judge; it is not every untrained mind that can follow the mathematics of relativity or other difficult scientific truths or judge of the validity either of their result or their process. All reality, all experience must indeed, to be held as true, be capable of verification by a same or similar experience; so, in fact, all men can have a spiritual experience and can follow it out and verify it in themselves, but only when they have acquired the capacity or can follow the inner methods by which that experience and verification are made possible. It is necessary to dwell for a moment on these obvious and elementary truths because the opposite ideas have been sovereign in a recent period of human mentality,\u2014they are now only receding,\u2014and have stood in the way of the development of a vast domain of possible knowledge. It is of supreme importance for the human spirit to be free to sound the depths of inner or subliminal reality, of spiritual and of what is still super conscient reality, and not to immure itself in the physical mind and its narrow domain of objective external solidities; for in that way alone can there come liberation from the Ignorance in which our mentality dwells and a release into a complete consciousness, a true and integral self-realisation and self-knowledge."","
"""Our conception of the Ignorance will necessarily determine our conception of the Knowledge and determine, therefore, since our life is the Ignorance at once denying and seeking after the Knowledge, the goal of human effort and the aim of the cosmic endeavour. Integral knowledge will then mean the cancelling of the sevenfold Ignorance by the discovery of what it misses and ignores, a sevenfold self-revelation within our consciousness: it will mean the knowledge of the Absolute as the origin of all things; the knowledge of the Self, the Spirit, the Being and of the cosmos as the Self's becoming, the becoming of the Being, a manifestation of the Spirit; the knowledge of the world as one with us in the consciousness of our true self, thus cancelling our division from it by the separative idea and life of ego; the knowledge of our psychic entity and its immortal persistence in Time beyond death and earth-existence; the knowledge of our greater and inner existence behind the surface; the knowledge of our mind, life and body in its true relation to the self within and the superconscient spiritual and supramental being above them; the knowledge, finally, of the true harmony and true use of our thought, will and action and a change of all our nature into a conscious expression of the truth of the Spirit, the Self, the Divinity, the integral spiritual Reality."","
"""An integral knowledge presupposes an integral Reality; for it is the power of a Truth-consciousness which is itself the consciousness of the Reality. But our idea and sense of Reality vary with our status and movement of consciousness, its sight, its stress, its intake of things; that sight or stress can be intensive and exclusive or extensive, inclusive and comprehensive. It is quite possible\u2014and it is in its own field a valid movement for our thought and for a very high line of spiritual achievement\u2014to affirm the existence of the ineffable Absolute, to emphasise its sole Reality and to negate and abolish for our self, to expunge from our idea and sense of reality, the individual being and the@660@ cosmic creation. The reality of the individual is Brahman the Absolute; the reality of the cosmos is Brahman the Absolute: the individual is a phenomenon, a temporal appearance in the cosmos; the cosmos itself is a phenomenon, a larger and more complex temporal appearance. The two terms, Knowledge and Ignorance, belong only to this appearance; in order to reach an absolute superconsciousness both have to be transcended: ego-consciousness and cosmic consciousness are extinguished in that supreme transcendence and there remains only the Absolute. For the absolute Brahman exists only in its own identity and is beyond all other-knowledge; there the very idea of the knower and the known and therefore of the knowledge in which they meet and become one, disappears, is transcended and loses its validity, so that to mind and speech the absolute Brahman must remain always unattainable. In opposition to the view we have put forward or in completion of it,\u2014the view of the Ignorance itself as only either a limited or an involved action of the divine Knowledge, limited in the partly conscient, involved in the inconscient,\u2014we might say from this other end of the scale of things that Knowledge itself is only a higher Ignorance, since it stops short of the absolute Reality which is self-evident to Itself but to mind unknowable. This absolutism corresponds to a truth of thought and to a truth of supreme experience in the spiritual consciousness; but by itself it is not the whole of spiritual thought complete and comprehensive and it does not exhaust the possibilities of the supreme spiritual experience."","
"""It is clear that a Mind of the nature of our surface intelligence can be only a secondary power of existence. For it bears the stamp of incapacity and ignorance as a sign that it is derivative and not the original creatrix; we see that it does not know or understand the objects it perceives, it has no automatic control of them; it has to acquire a laboriously built knowledge and controlling power. This initial incapacity could not be there if these objects were the Mind's own structures, creations of its self-Power. It may be that this is so because individual mind has only a frontal and derivative power and knowledge and there is a universal Mind that is whole, endowed with omniscience, capable of omnipotence. But the nature of Mind as we know it is an Ignorance seeking for knowledge; it is a knower of fractions and worker of divisions striving to arrive at a sum, to piece together a whole,\u2014it is not possessed of the essence of things or their totality: a universal Mind of the same character might know the sum of its divisions by force of its universality, but it would still lack the essential knowledge, and without the essential knowledge there could be no true integral knowledge. A consciousness possessing the essential and integral knowledge, proceeding from the essence to the whole and from the whole to the parts, would be no longer Mind, but a perfect Truth-Consciousness automatically possessed of inherent self knowledge and world-knowledge. It is from this basis that we have to look at the subjective view of reality. It is true that there is no such thing as an objective reality independent of@671@ consciousness; but at the same time there is a truth in objectivity and it is this, that the reality of things resides in something that is within them and is independent of the interpretation our mind gives to them and of the structures it builds upon its observation. These structures constitute the mind's subjective image or figure of the universe, but the universe and its objects are not a mere image or figure. They are in essence creations of consciousness, but of a consciousness that is one with being, whose substance is the substance of Being and whose creations too are of that substance, therefore real. In this view the world cannot be a purely subjective creation of Consciousness; the subjective and the objective truth of things are both real, they are two sides of the same Reality."","
"""On the one side, then, presented to us as the Reality, we have an absolute Self-Existence, an eternal sole self-being, and through the experience of the silent and inactive Self or the detached immobile Purusha we can move towards this featureless and@636@ relationless Absolute, negate the actions of the creative Power, whether that be an illusory Maya or a formative Prakriti, pass from all circling in cosmic error into the eternal Peace and Silence, get rid of our personal existence and find or lose ourselves in that sole true Existence. On the other side, we have a Becoming which is a true movement of Being, and both the Being and the Becoming are truths of one absolute Reality. The first view is founded on the metaphysical conception which formulates an extreme perception in our thought, an exclusive experience in our consciousness of the Absolute as a reality void of all relations and determinations: that imposes as its consequence a logical and practical necessity to deny the world of relativities as a falsity of unreal being, a Non-Existent (Asat), or at least a lower and evanescent, temporal and pragmatic self-experience, and to cut it away from the consciousness in order to arrive at liberation of the spirit from its false perceptions or its inferior creations. The second view is based on the conception of the Absolute as neither positively nor negatively limitable. It is beyond all relations in the sense that it is not bound by any relativities or limitable by them in its power of being: it cannot be tied down and circumscribed by our relative conceptions, highest or lowest, positive or negative; it is bound neither by our knowledge nor by our ignorance, neither by our concept of existence nor by our concept of non-existence. But neither can it be limited by any incapacity to contain, sustain, create or manifest relations: on the contrary, the power to manifest itself in infinity of unity and infinity of multiplicity can be regarded as an inherent force, sign, result of its very absoluteness, and this possibility is in itself a sufficient explanation of cosmic existence. The Absolute cannot indeed be bound in its nature to manifest a cosmos of relations, but neither can it be bound not to manifest any cosmos. It is not itself a sheer emptiness; for a vacant Absolute is no Absolute,\u2014our conception of a Void or Zero is only a conceptual sign of our mental inability to know or grasp it: it bears in itself some ineffable essentiality of all that is and all that can be; and since it holds in itself this essentiality and this possibility, it must also hold in itself in some way of its absoluteness either the permanent truth or the inherent, even if latent, realisable actuality@637@ of all that is fundamental to our or the world's existence. It is this realisable actuality actualised or this permanent truth deploying its possibilities that we call manifestation and see as the universe."","
"""But there are other conceptions of reality, other conceptions of the nature of knowledge which demand consideration. There is the view that all that exists is a subjective creation of Mind, a structure of Consciousness, and that the idea of an objective reality self-existent, independent of Consciousness, is an illusion, since we have and can have no evidence of any such independent self-existence of things. This way of seeing may lead to the affirmation of the creative Consciousness as the sole Reality or to the denial of all existence and the affirmation of Non-Existence or a nescient Zero as the sole Reality. For, in one view, the objects constructed by consciousness have no intrinsic reality, they are merely structures; even the consciousness that constructs them is itself only a flux of perceptions that assume an appearance of connection and continuity and create a sense of continuous time, but in reality these things have no stable basis as they are only an appearance of reality. This would mean that the reality is an eternal absence at once of all self-conscious existence and of all that constitutes movement of existence: Knowledge would mean a return to that from the appearance of the constructed universe. There would be a double and complete self-extinction, the disappearance of Purusha, the cessation or extinction of Prakriti; for the conscious Soul and Nature are@642@ the two terms of our being and comprehend all that we mean by existence, and the negation of both is the absolute Nirvana. What is real, then, must be either an Inconscience, in which this flux and these structures appear, or a Superconscience beyond all idea of self or existence. But this view of the universe is only true of the appearance of things when we regard our surface mind as the whole of consciousness; as a description of the working of that Mind it is valid; there, undoubtedly, all looks like a flux and a construction by an impermanent Consciousness. But this cannot prevail as a whole account of existence if there is a greater and deeper self-knowledge and world-knowledge, a knowledge by identity, a consciousness to which that knowledge is normal and a Being of which that consciousness is the eternal self-awareness; for then the subjective and the objective can be real and intimate to that consciousness and being, both can be something of itself, sides of its identity, authentic to its existence."","
"""But this is not an intellectual knowledge which can be learned and completed in our present mould of consciousness; it must be an experience, a becoming, a change of consciousness, a change of being. This brings in the evolutionary character of the Becoming and the fact that our mental ignorance is only a stage in our evolution. The integral knowledge, then, can only come by an evolution of our being and our nature, and that would seem to signify a slow process in Time such as has accompanied the other evolutionary transformations. But as against that inference there is the fact that the evolution has now become conscious@655@ and its method and steps need not be altogether of the same character as when it was subconscious in its process. The integral knowledge, since it must result from a change of consciousness, can be gained by a process in which our will and endeavour have a part, in which they can discover and apply their own steps and method: its growth in us can proceed by a conscious self-transformation. It is necessary then to see what is likely to be the principle of this new process of evolution and what are the movements of the integral knowledge that must necessarily emerge in it,\u2014or, in other words, what is the nature of the consciousness that must be the base of the life divine and how that life may be expected to be formed or to form itself, to materialise or, as one might say, to \""realise\"".@656@"","
"""On the one side, then, presented to us as the Reality, we have an absolute Self-Existence, an eternal sole self-being, and through the experience of the silent and inactive Self or the detached immobile Purusha we can move towards this feature less and relationless Absolute, negate the actions of the creative Power, whether that be an illusory Maya or a formative Prakriti, pass from all circling in cosmic error into the eternal Peace and Silence, get rid of our personal existence and find or lose ourselves in that sole true Existence. On the other side, we have a Becoming which is a true movement of Being, and both the Being and the Becoming are truths of one absolute Reality. The first view is founded on the metaphysical conception which formulates an extreme perception in our thought, an exclusive experience in our consciousness of the Absolute as a reality void of all relations and determinations: that imposes as its consequence a logical and practical necessity to deny the world of relativities as a falsity of unreal being, a non-existent (Asat), or at least a lower and evanescent, temporal and pragmatic self experience, and to cut it away from the consciousness in order to arrive at liberation of the spirit from its false perceptions or its inferior creations. The second view is based on the conception of the Absolute as neither positively nor negatively limitable. It is beyond all relations in the sense that it is not bound by any relativities or limitable by them in its power of being: it cannot be tied down and circumscribed by our relative conceptions, highest or lowest, positive or negative; it is bound neither by our knowledge nor by our ignorance, neither by our concept of existence nor by our concept of non-existence. But neither can it be limited by any incapacity to contain, sustain, create or manifest relations: on the contrary, the power to manifest itself in infinity of unity and infinity of multiplicity can be regarded as an inherent force, sign, result of its very absoluteness, and this possibility is in itself a sufficient explanation of cosmic@663@ existence. The Absolute cannot indeed be bound in its nature to manifest a cosmos of relations, but neither can it be bound not to manifest any cosmos. It is not itself a sheer emptiness; for a vacant Absolute is no Absolute,\u2014our conception of a Void or Zero is only a conceptual sign of our mental inability to know or grasp it: it bears in itself some ineffable essentiality of all that is and all that can be; and since it holds in itself this essentiality and this possibility, it must also hold in itself in some way of its absoluteness either the permanent truth or the inherent, even if latent, realisable actuality of all that is fundamental to our or the world's existence. It is this realisable actuality actualised or this permanent truth deploying its possibilities that we call manifestation and see as the universe."","
"""On the other hand, if the constructing Mind or Consciousness is real and the sole reality, then the universe of material beings and objects may have an existence, but it is purely subjective-structural, made by Consciousness out of itself, maintained by it, dissolving into it in their disappearance. For if there is nothing else, no essential Existence or Being supporting the creative Power, and there is not, either, a sustaining Void or Nihil, then this Consciousness which creates everything must itself have or be an existence or a substance; if it can make structures, they must be constructions out of its own substance or forms of its own existence. A consciousness which is not that of an Existence or is not itself an existence, must be an unreality, a perceptive Force of a Void or in a Void raising there unreal structures made of nothing,\u2014a proposition which is not easily acceptable unless all others prove to be invalid. It then becomes apparent that what we see as consciousness must be a Being or an Existence out of whose substance of consciousness all is created."","
